{
  "id": "template-c3m-v0.2.0",
  "code": "C3M",
  "name": "C3M - Rapport d'inspection du personnel de maîtrise / direction",
  "version": "0.2.0",
  "description": "PLACEHOLDER — structure initiale du formulaire C3M, alignée sur le nouveau schéma (conversionTable, fieldGroups, synthesis). Aucun document officiel C3M n'a encore été fourni : les libellés exacts des sections et critères restent à intégrer.",
  "isActive": false,
  "header": {
    "fields": [
      {
        "key": "inspecteur",
        "code": "01",
        "label": "Inspecteur",
        "type": "text",
        "required": true,
        "common": true,
        "order": 1
      },
      {
        "key": "etablissement",
        "code": "06",
        "label": "Etablissement",
        "type": "text",
        "required": true,
        "common": true,
        "order": 2
      },
      {
        "key": "entite_inspectee",
        "code": "07",
        "label": "Entité inspectée",
        "type": "text",
        "required": true,
        "common": true,
        "order": 3,
        "helpText": "Enseignant/entité inspectée — pour le C3M, le membre du personnel de maîtrise/direction inspecté."
      },
      {
        "key": "annee_scolaire",
        "code": "10",
        "label": "Année scolaire",
        "type": "text",
        "required": true,
        "common": true,
        "order": 4
      },
      {
        "key": "numero_rapport",
        "code": "11",
        "label": "Rapport n°",
        "type": "text",
        "required": true,
        "common": true,
        "order": 5
      }
    ]
  },
  "fieldGroups": [],
  "sections": [
    {
      "id": "c3m-sS1",
      "code": "S1",
      "title": "Section à compléter (exemple de structure)",
      "order": 1,
      "criteria": [
        {
          "id": "c3m-cS1-1",
          "code": "S1.1",
          "label": "Critère d'exemple 1",
          "maxScore": 4,
          "order": 1
        },
        {
          "id": "c3m-cS1-2",
          "code": "S1.2",
          "label": "Critère d'exemple 2",
          "maxScore": 4,
          "order": 2
        }
      ],
      "observationsLabel": "Observations",
      "adviceZone": {
        "enabled": true,
        "label": "Conseils",
        "required": false
      },
      "custom_fields": [],
      "description": "PLACEHOLDER — remplacer par les rubriques officielles du C3M (ex: gestion administrative, animation pédagogique, gestion du personnel, etc.)."
    }
  ],
  "conversionTable": {
    "mode": "lookup_by_criteria_count",
    "bands": [
      {
        "scoreOn4": 4,
        "minPercentage": 80,
        "maxPercentage": 100,
        "mention": "ELITE"
      },
      {
        "scoreOn4": 3,
        "minPercentage": 70,
        "maxPercentage": 79.99,
        "mention": "TRES BON"
      },
      {
        "scoreOn4": 2,
        "minPercentage": 50,
        "maxPercentage": 69.99,
        "mention": "BON"
      },
      {
        "scoreOn4": 1,
        "minPercentage": 40,
        "maxPercentage": 49.99,
        "mention": "ASSEZ BON"
      },
      {
        "scoreOn4": 0,
        "minPercentage": 0,
        "maxPercentage": 39.99,
        "mention": "MEDIOCRE"
      }
    ],
    "rows": [
      {
        "criteriaCount": 2,
        "ranges": [
          {
            "min": 7,
            "max": 8
          },
          {
            "min": 6,
            "max": 6
          },
          {
            "min": 4,
            "max": 5
          },
          {
            "min": 3,
            "max": 3
          },
          {
            "min": 0,
            "max": 2
          }
        ]
      },
      {
        "criteriaCount": 3,
        "ranges": [
          {
            "min": 10,
            "max": 12
          },
          {
            "min": 8,
            "max": 9
          },
          {
            "min": 6,
            "max": 7
          },
          {
            "min": 5,
            "max": 5
          },
          {
            "min": 0,
            "max": 4
          }
        ]
      },
      {
        "criteriaCount": 4,
        "ranges": [
          {
            "min": 13,
            "max": 16
          },
          {
            "min": 11,
            "max": 12
          },
          {
            "min": 8,
            "max": 10
          },
          {
            "min": 6,
            "max": 7
          },
          {
            "min": 0,
            "max": 5
          }
        ]
      },
      {
        "criteriaCount": 5,
        "ranges": [
          {
            "min": 16,
            "max": 20
          },
          {
            "min": 14,
            "max": 15
          },
          {
            "min": 10,
            "max": 13
          },
          {
            "min": 8,
            "max": 9
          },
          {
            "min": 0,
            "max": 7
          }
        ]
      },
      {
        "criteriaCount": 6,
        "ranges": [
          {
            "min": 19,
            "max": 24
          },
          {
            "min": 17,
            "max": 18
          },
          {
            "min": 12,
            "max": 16
          },
          {
            "min": 10,
            "max": 11
          },
          {
            "min": 0,
            "max": 9
          }
        ]
      },
      {
        "criteriaCount": 7,
        "ranges": [
          {
            "min": 22,
            "max": 28
          },
          {
            "min": 20,
            "max": 21
          },
          {
            "min": 14,
            "max": 19
          },
          {
            "min": 11,
            "max": 13
          },
          {
            "min": 0,
            "max": 10
          }
        ]
      },
      {
        "criteriaCount": 8,
        "ranges": [
          {
            "min": 26,
            "max": 32
          },
          {
            "min": 22,
            "max": 25
          },
          {
            "min": 16,
            "max": 21
          },
          {
            "min": 13,
            "max": 15
          },
          {
            "min": 0,
            "max": 12
          }
        ]
      },
      {
        "criteriaCount": 9,
        "ranges": [
          {
            "min": 29,
            "max": 36
          },
          {
            "min": 26,
            "max": 28
          },
          {
            "min": 18,
            "max": 25
          },
          {
            "min": 15,
            "max": 17
          },
          {
            "min": 0,
            "max": 14
          }
        ]
      },
      {
        "criteriaCount": 10,
        "ranges": [
          {
            "min": 32,
            "max": 40
          },
          {
            "min": 28,
            "max": 31
          },
          {
            "min": 20,
            "max": 27
          },
          {
            "min": 16,
            "max": 19
          },
          {
            "min": 0,
            "max": 15
          }
        ]
      }
    ]
  },
  "synthesis": {
    "title": "Evaluation synthétique",
    "rows": [
      {
        "sectionId": "c3m-sS1",
        "label": "Section à compléter (exemple de structure)"
      }
    ],
    "conversionCriteriaCount": 1,
    "finalMentionLabel": "NOTE FINALE",
    "finalMentionHelpText": "PLACEHOLDER",
    "sealLabel": "Sceau de l'établissement"
  },
  "signatures": {
    "roles": [
      {
        "role": "enseignant",
        "label": "Entité inspectée — pour prise de connaissance et réception",
        "required": true,
        "order": 1
      },
      {
        "role": "chef_etablissement",
        "label": "Chef d'établissement — pour prise de connaissance et réception",
        "required": true,
        "order": 2
      },
      {
        "role": "inspecteur",
        "label": "Inspecteur",
        "required": true,
        "order": 3
      }
    ]
  }
}
